Date,City,State,Country,Shape,Duration,Summary,Posted,Images,ReportNum,Location,Latitude,Longitude
10/25/2022 19:03,Buffalo,NY,USA,Triangle,6 seconds,"Super fast triangle shaped craft, no noise, a white light on each corner, moved from direct 90 degrees above to horizon in 6 seconds",12/22/2022,,1412,"Buffalo, NY",42.8864468,-78.8783689
10/25/2022 16:22,Barstow,CA,USA,Circle,10 min,Starbuck island on Google earth there is what looks like a crashed craft at one end of island leaving a scar on the ground leading up t,12/22/2022,,1413,"Barstow, CA",34.8957957,-117.0172826
10/25/2022 15:59,Porter county,IN,USA,Changing,Every where i go,((NFORC Note:  HOAX??  PD))Every where I go,12/22/2022,,1414,"Porter county, IN",41.5248577,-87.1023746
10/25/2022 14:00,Portland,OR,USA,Triangle,15-20 min,A leaf was doing gymnastics that seemed to defy any reality I know.,12/22/2022,,1415,"Portland, OR",45.515232,-122.6783853
10/25/2022 5:50,Georgetown,TX,USA,Light,Maybe a minute,Bright light high in atmosphere shot across the sky on a straight trajectory faster than anything I've ever seen,12/22/2022,,1416,"Georgetown, TX",30.6332618,-97.6779842
10/25/2022 5:20,Myrtle Beach,SC,USA,Triangle,15 to 20 seconds,Triangle w 3 lights moved as one huge object.,12/22/2022,,1417,"Myrtle Beach, SC",33.6890603,-78.8866943
10/25/2022 4:06,Ocean Shores,WA,USA,Sphere,15 min.,White/blue sparkling lights,12/22/2022,,1418,"Ocean Shores, WA",47.0074167,-124.1613653
10/25/2022 3:05,Stanford,KY,USA,Circle,10 min including 2 camera,Refer to video,12/22/2022,,1419,"Stanford, KY",37.5311901,-84.6618876
10/25/2022 3:05,Stanford,KY,USA,Circle,5 mins,Via security camera,12/22/2022,,1420,"Stanford, KY",37.5311901,-84.6618876
10/25/2022 2:00,Oxford,MI,USA,Unknown,Minutes,((NUFORC Note:  HOAX??  PD))  Very light white ufos showing out of no where—& Blue Alien,12/22/2022,Yes,1421,"Oxford, MI",42.8247293,-83.2652254
10/25/2022 1:47,Shawnee,KS,USA,Circle,1m 52sec,Seen a bright perfectly circular pulsating object in the sky disappearing and reappearing,12/22/2022,Yes,1422,"Shawnee, KS",39.0228485,-94.7151865
10/25/2022 1:00,Cape Coral,FL,USA,Changing,Until 4:445 AM,Looking outside at the stars when I noticed one of the stars was flashing colors. I zoomed in on my phone and was able to see,12/22/2022,Yes,1423,"Cape Coral, FL",26.5628537,-81.9495331
10/24/2022 22:45,Port Richey,FL,USA,Light,2 seconds,"I saw a very faint streak of light stream across the sky, it changed direction from north to south, to southwest through path.",12/22/2022,,1424,"Port Richey, FL",28.2716755,-82.7195451
10/24/2022 21:24,Miami,FL,USA,Sphere,30sec to 1min,White glowing orb. Moves quickly and does dark. Not visible,12/22/2022,Yes,1425,"Miami, FL",25.7616798,-80.1917902
10/24/2022 21:03,Erie,PA,USA,Triangle,About 2 seconds.,Lights moving across the sky.,12/22/2022,,1426,"Erie, PA",42.1292241,-80.085059
10/24/2022 20:45,Niagara Falls,NY,USA,Circle,now had been 45 minutes,"A very bright white round white was stationary in the sky, with a red light orbiting it",12/22/2022,,1427,"Niagara Falls, NY",43.0962143,-79.0377388
10/24/2022 19:23,Fontana,CA,USA,Oval,About 4 -5 seconds,Looked up saw oval object appear on fire fell from the sky downward into the mountain area north of Duncan cyn & 15 fwy,12/22/2022,Yes,1428,"Fontana, CA",34.0922335,-117.435048
10/24/2022 19:03,LAKE HAVASU CITY,CA,USA,Light,5 minutes,Blinking Lights following Each other,12/22/2022,,1429,"LAKE HAVASU CITY, CA",34.483901,-114.3224548
10/24/2022 7:00,Cincinnati,OH,USA,Circle,3 minutes,I was taking time lapses of sunrise when I notice a bright light come out of one cloud and float to another,12/22/2022,Yes,1430,"Cincinnati, OH",39.1031182,-84.5120196
10/24/2022 6:52,Holmesville,OH,USA,Triangle,2 Minutes,Triangle shaped object moving steadily across sky,12/22/2022,,1431,"Holmesville, OH",40.6295049,-81.9243089
10/24/2022 2:02,Bakersfield,CA,USA,Changing,2 hours -8 hours,Yellow orange color changing shape changing object.,12/22/2022,Yes,1432,"Bakersfield, CA",35.3732921,-119.0187125
10/24/2022 1:13,Morristown,TN,USA,Light,,"Blinking and hovering light. Flashes green, red, and white. No sound.",12/22/2022,Yes,1434,"Morristown, TN",36.2139814,-83.2948922
10/23/2022 23:42,Garfield Hts,OH,USA,Unknown,25 minutes and county,"Three in vertical line,two on horizontal ends flickering",12/22/2022,,1435,"Garfield Hts, OH",41.4169974,-81.6059581
10/23/2022 22:30,Lexington,SC,USA,Disk,5-8 Minutes,I was burned by UFO after jokingly trying to communicate with 1 of several crafts that were flying in the sky.,12/22/2022,Yes,1436,"Lexington, SC",33.9815369,-81.2362107
10/23/2022 21:39,Abiqui,NM,USA,Circle,1 hour,I have been seeing these crafts daily it almost feels like they are following me,12/22/2022,Yes,1437,"Abiqui, NM",36.207241,-106.3186397
10/23/2022 20:30,Mount Vernon,OH,USA,Triangle,I filmed for 3 1/2 minute,"I filmed the object for 3 1/2 minutes, until it went straight up, and disappeared.",12/22/2022,Yes,1438,"Mount Vernon, OH",40.3932283,-82.485436
10/23/2022 20:01,Waterford,WI,USA,Light,6 seconds,I saw a rectangular circle like white light with a blue like hue to it above me. It went from being this square/circle like shape,12/22/2022,,1439,"Waterford, WI",42.7630722,-88.2142563
10/23/2022 19:10,Arroyo Grande,CA,USA,Triangle,I think around a minute,Triangle of lights flashing red and green. It didn’t look like the airplanes I normally see - the triangle had more points of light,12/22/2022,,1440,"Arroyo Grande, CA",35.1185868,-120.5907252
10/23/2022 19:00,Columbus,OH,USA,Unknown,1-2 min,Bright sphere at night,12/22/2022,,1441,"Columbus, OH",39.9611755,-82.9987942
10/23/2022 14:30,Essex Junction,VT,USA,Other,1.04 Seconds,Was flying my FPV drone and this object passes in front of me.,12/22/2022,Yes,1442,"Essex Junction, VT",44.4905433,-73.1112207
10/23/2022 12:27,Tonto Basin,AZ,USA,Other,Unknown,"Odd object just North of Tonto Basin, AZ",12/22/2022,Yes,1443,"Tonto Basin, AZ",33.8502345,-111.3104752
10/23/2022 3:00,Magalia,CA,USA,Sphere,Approx 20 mins,I woke around 3am to a humming noise and thinking it was daytime,12/22/2022,,1444,"Magalia, CA",39.8121058,-121.5783059
10/22/2022 22:50,Oro Valley,AZ,USA,Changing,10 minutes,My mom and I saw the sky move.,12/22/2022,,1445,"Oro Valley, AZ",32.3909071,-110.966488
10/22/2022 22:11,Brooklyn,NY,USA,Changing,Appropriately 35 seconds,Two UFO’s seen. HD Video taken with iphone 11,12/22/2022,Yes,1446,"Brooklyn, NY",40.6781784,-73.9441579
10/22/2022 21:54,Everett,WA,USA,Disk,It was fast so 10 seconds,It was lit up a huge saucer flying south in the sky at the speed of light and flashing,12/22/2022,,1447,"Everett, WA",47.9789848,-122.2020794
10/22/2022 21:48,Pekin,IL,USA,Sphere,2-3 Seconds,The Orb/Sphere randomly appeared out of nowhere around mid sky. The craft hovered for about 2 seconds and then shot towards the ground.,12/22/2022,,1448,"Pekin, IL",40.5675388,-89.640658
10/22/2022 21:36,Houston,TX,USA,Oval,15 seconds,"A brown beetle shaped craft flew over Harris County Texas under cloud cover on the first night of Jupiter's shining, October 22, 2022.",12/22/2022,,1449,"Houston, TX",29.7604267,-95.3698028
10/22/2022 21:15,Yakima,WA,USA,Unknown,At least 75 minutes,Looked like a bright twinkling star. Eraditic and abrupt change in speed with sharp right angle turns like the letter ‘L’.,12/22/2022,,1450,"Yakima, WA",46.6020711,-120.5058987
10/22/2022 20:00,Jonesboro,AR,USA,Triangle,20 sec,Saw three lights in a triangle shape about 80 over a house not moving.,12/22/2022,,1451,"Jonesboro, AR",35.835696,-90.7051346
10/22/2022 20:00,Naples,FL,USA,Circle,30-45 seconds max,"I thought it was a satellite, but far too close, too fast, and no actual “craft” seen-it was like a moving star that was moving fast",12/22/2022,,1452,"Naples, FL",26.1420358,-81.7948103
10/22/2022 19:39,Westland,MI,USA,Circle,About a monite,I captured it on my ring cam it could be a drone but it looked odd shaped not saying it's an ufo but I couldn't make out what it was,12/22/2022,Yes,1453,"Westland, MI",42.324204,-83.400211
10/22/2022 19:30,Arlington,TX,USA,Unknown,15 seconds,Green and white lights in the sky in a dark neighborhood.,12/22/2022,Yes,1454,"Arlington, TX",32.735687,-97.1080656
10/22/2022 18:18,Murfreesboro,TN,USA,Light,Filmed 40 seconds,Seen again a spinning white light over temple,12/22/2022,,1455,"Murfreesboro, TN",35.8456213,-86.39027
10/22/2022 12:15,marina del rey los angeles,CA,USA,Sphere,4 seconds,oraange flew with blackhawk over jettys rock in marina del rey los angeles at 1215pm,12/22/2022,Yes,1456,"marina del rey los angeles, CA",33.9802893,-118.4517449
10/22/2022 9:20,HARTSVILLE,SC,USA,Cylinder,A few minutes,"We could see a bright cylinder shaped object through the trees, a minute after this a jet could be seen flying over...",12/22/2022,Yes,1457,"HARTSVILLE, SC",34.3742857,-80.0733313
10/22/2022 7:51,Chadwick,IL,USA,Cylinder,3min,Early morning sighting,12/22/2022,Yes,1458,"Chadwick, IL",42.0133599,-89.8906765
10/22/2022 6:22,Berwyn,IL,USA,Changing,2 minutes,Clear morning night sky,12/22/2022,,1459,"Berwyn, IL",41.8505874,-87.7936685
10/22/2022 1:30,St George,UT,USA,Light,Over 30 minutes. Months,3 sets of 2. Another showed up followed by streaking light.,12/22/2022,,1460,"St George, UT",37.0965278,-113.5684164
10/22/2022 1:15,Saint Louis,MO,USA,Changing,Over 2 hours,Multiple objects observed over several hours,12/22/2022,Yes,1461,"Saint Louis, MO",38.6270025,-90.1994042
10/22/2022 0:58,Lakewood,CO,USA,Sphere,7 Years,4 Ships going from West to East,12/22/2022,,1462,"Lakewood, CO",39.7047095,-105.0813734
10/22/2022 0:53,Grandview,MO,USA,Chevron,10 seconds,I have documented witnessing this aircraft before with Missouri MUFON. I have seen this before a few times. It's the TR6 TELOS.. PLEASE,12/22/2022,,1463,"Grandview, MO",38.8858407,-94.5330096
10/22/2022 0:30,Hawthorne,NV,USA,Other,30 Seconds,I saw this weird formation of multiple cloud shaped flying objects going against the wind.,12/22/2022,,1464,"Hawthorne, NV",38.5246441,-118.624578
10/21/2022 23:40,Naples,FL,USA,Triangle,5 seconds,"3 triangular shaped crafts, dark, silent, no lights, very fast, in formation",12/22/2022,,1465,"Naples, FL",26.1420358,-81.7948103
10/21/2022 22:30,Rehoboth Beach,DE,USA,Light,lengthy and continual,After retiring to bed have straight up view of heavens. Always seem waiting for me and continuing as long as I keep looking.,12/22/2022,,1466,"Rehoboth Beach, DE",38.7209454,-75.0760137
10/21/2022 22:29,Oklahoma City,OK,USA,Unknown,10 minutes,"At least three flashing lights on a single craft (shape not seen), relatively large, unlike any other aircraft I see regularly.",12/22/2022,,1467,"Oklahoma City, OK",35.4675602,-97.5164276
10/21/2022 21:15,Washington DC,DC,USA,Formation,10 seconds,I was walking home and took a picture of the monument.  ((NUFORC Note:  Lens flare caused by photographing bright lights.  PD)),12/22/2022,Yes,1468,"Washington DC, DC",38.9071923,-77.0368707
10/21/2022 20:51,Washington dc,DC,USA,Formation,5 sec,I was walking home and took a few pic of the monument.  ((NUFORC Note:  Lens flares.  PD)),12/22/2022,Yes,1469,"Washington dc, DC",38.9071923,-77.0368707
10/21/2022 20:31,PORT ORANGE,FL,USA,Circle,,Saw bright round appeared to be rotating.,12/22/2022,,1470,"PORT ORANGE, FL",29.1383165,-80.9956105
10/21/2022 13:12,Taos,NM,USA,Egg,10 - 15 min,Objects appears to just pop in sight. They move slowly eastward and seem to tilt so that the sun reflects back and forth.,12/22/2022,Yes,1472,"Taos, NM",36.4072134,-105.5733788
10/21/2022 6:19,Dennis,MA,USA,Light,2 minutes,"Silent, unblinking white light moving slowly ENE at a time when no air or satellite traffic in area.",12/22/2022,,1473,"Dennis, MA",41.7353062,-70.1939429
10/21/2022 6:00,Little Rock,AR,USA,Star,at least 30 minutes,white star shaped dot moving back and forth,12/22/2022,,1474,"Little Rock, AR",34.7444618,-92.2880157
10/21/2022 2:50,Kansas City,MO,USA,Formation,5 min,3 lights in formation,12/22/2022,,1475,"Kansas City, MO",39.0997265,-94.5785667
10/21/2022 2:30,New Port Richey,FL,USA,Disk,45 mins,Disk shape flashing colors hovering and bouncing around,12/22/2022,,1476,"New Port Richey, FL",28.2441768,-82.7192671
10/20/2022 23:30,North Miami,FL,USA,Circle,A few minutes,"A red glowing circle was blinking and flashing, then moved to the left quickly, then diagonally back to the right, then down and disapp",12/22/2022,,1477,"North Miami, FL",25.8900949,-80.1867138
10/20/2022 23:00,Colorado Springs,CO,USA,Circle,For about 12 minutes,6 plus circle objects,12/22/2022,,1478,"Colorado Springs, CO",38.8338816,-104.8213634
10/20/2022 22:30,Ridgeland,SC,USA,Light,30 minutes,Military helicopter following a light,12/22/2022,,1479,"Ridgeland, SC",32.4807435,-80.980386
10/20/2022 21:12,Lavon,TX,USA,Light,2-3 seconds,Light white flaring light zipped in an arc under a helicopter,12/22/2022,,1481,"Lavon, TX",33.0276193,-96.4341524
10/20/2022 20:40,San Jose,CA,USA,Fireball,45 seconds,I was driving in the hway and out of the Blue in the sky. There was a small fireball and it gets bigger. We saw it about 1 min,12/22/2022,,1482,"San Jose, CA",37.33874,-121.8852525
10/20/2022 20:22,Jacksonville,FL,USA,Cigar,5 minutes,"Cigar shaped craft no sound, bright, nothing carrying it, began to move when I started filming and faded out into thin air",12/22/2022,Yes,1483,"Jacksonville, FL",30.3321838,-81.655651
10/20/2022 20:04,Washington Court House,OH,USA,Circle,Seconds,Bright orange lights triangle shape,12/22/2022,,1484,"Washington Court House, OH",39.5373688,-83.437579
10/20/2022 19:45,Marion,NC,USA,Fireball,5 to 7 minutes,2 objects that looked like fire ball or very strong light moving west to east,12/22/2022,,1485,"Marion, NC",35.6840131,-82.0092745
10/20/2022 19:30,jackson,AL,USA,Cigar,1 minute,cigar shaped large craft with twinkling lights moving slowly and making no sound,12/22/2022,,1486,"jackson, AL",31.5090521,-87.8944435
10/20/2022 19:23,Katy,TX,USA,Other,2 minutes,A 3D CD object,12/22/2022,Yes,1487,"Katy, TX",29.7857765,-95.8245093
10/20/2022 19:22,Mandeville,LA,USA,Rectangle,8 minutes,Formation of lights moving slowly,12/22/2022,Yes,1488,"Mandeville, LA",30.3582506,-90.0656311
10/20/2022 19:20,-,NM,USA,Triangle,5 sec,Two light at each end that made up a triangle. A shooting light. A light moving away from me.,12/22/2022,Yes,1489,"-, NM",34.5199402,-105.8700901
10/20/2022 16:00,Falling Waters,WV,USA,Cylinder,15 seconds,"Unknown object, like skinny blimp or tube",12/22/2022,,1490,"Falling Waters, WV",39.559546,-77.890639
10/20/2022 14:00,Spring Valley,CA,USA,Light,,Some flashing/pulsing lights in the midday sky that kind of milled around,12/22/2022,,1491,"Spring Valley, CA",32.744774,-116.998916
10/20/2022 13:26,Reno,NV,USA,Circle,Approximately 2 hours,"Small bright lights appear in the sky, move around, and disappear",12/22/2022,Yes,1492,"Reno, NV",39.529919,-119.8142691
10/20/2022 13:25,Booneville,MS,USA,Cigar,15 mins,"Brightest silver cigar shape, covered & moved slowly, no blinking lights.",12/22/2022,Yes,1493,"Booneville, MS",34.6581596,-88.5667036
10/20/2022 10:04,Sacramento,CA,USA,Triangle,less than a minute,UFO Hovering over apartment complexes in the area t,12/22/2022,,1494,"Sacramento, CA",38.5815719,-121.4943996
10/20/2022 6:20,Archbald,PA,USA,Circle,30 minutes,We were driving to Dunmore and I noticed it getting in our car it was in the western sky pulsing red green white light,12/22/2022,,1495,"Archbald, PA",41.4948038,-75.5368521
10/20/2022 6:00,Georgetown,TX,USA,Light,3 minutes,Bright light with no normal signaling lights or anything moved across the sky. Second sighting,12/22/2022,,1496,"Georgetown, TX",30.6332618,-97.6779842
10/20/2022 5:25,Schurz,NV,USA,Oval,Around three minutes,"Light opens in sky, rotates, then something shoots out to the mountain",12/22/2022,,1497,"Schurz, NV",38.9507534,-118.811256
10/20/2022 4:30,Oxford,MI,USA,Circle,5 min,A round object spinning & moving very fast,12/22/2022,,1498,"Oxford, MI",42.8247293,-83.2652254
10/20/2022 4:30,Star,ID,USA,Triangle,1min,1 aircraft NE to SW. No sound. Approx 1k AGL.,12/22/2022,,1499,"Star, ID",43.6921071,-116.4934631
10/20/2022 2:12,Toledo,OH,USA,Light,10 min,This is our second time seeing this bright light,12/22/2022,Yes,1501,"Toledo, OH",41.6528052,-83.5378674
10/20/2022 1:43,Amherst,OH,USA,Circle,1-2 seconds max,"We were driving and infront of us a very large blue circle craft thing, flew and disappeared infront us within 1-2 secs it was gone",12/22/2022,,1502,"Amherst, OH",41.3978217,-82.2223774
10/20/2022 1:00,denver,CO,USA,Oval,all night,ongoing nightly star like objects but much brighter & more intense flickering,12/22/2022,,1503,"denver, CO",39.7392358,-104.990251
10/19/2022 21:35,Bartlesville,OK,USA,Circle,happened really fast,"circle, chrome metallic look, thruster and fire trail.",12/22/2022,,1505,"Bartlesville, OK",36.7473114,-95.9808179
10/19/2022 21:00,Phoenix,AZ,USA,Light,2 hours at least,"I saw a bright star relatively high in the sky. I noted that it was moving erratically. It moved left, right, up, down, forward, back",12/22/2022,,1506,"Phoenix, AZ",33.4483771,-112.0740373
10/19/2022 21:00,Palm desert,CA,USA,Other,10 minutes,"Right place, right time",12/22/2022,,1507,"Palm desert, CA",33.7222445,-116.3744556
10/19/2022 20:00,Centerburg,OH,USA,Circle,39 seconds,Glowingly ball of light Chang shape instantly disappearing,12/22/2022,,1508,"Centerburg, OH",40.3043902,-82.6962371
10/19/2022 20:00,Cana,VA,USA,Changing,Changing shape still ther,Rather not say please contact me,12/22/2022,,1509,"Cana, VA",36.5895764,-80.6717345
10/19/2022 20:00,Cottonwood,AZ,USA,Light,30 seconds,Drove directly under there lights in triangle formation.,12/22/2022,,1510,"Cottonwood, AZ",34.7391876,-112.0098791
10/19/2022 19:21,Whittier,CA,USA,Light,,3 bright flashes like lightning,12/22/2022,,1511,"Whittier, CA",33.9791793,-118.032844
10/19/2022 19:17,Franklin,TN,USA,Other,6-7 minutes,This craft seemed to stay floating in one spot and did not move. It vanished for a few seconds and seemed to change shape.,12/22/2022,,1512,"Franklin, TN",35.9250637,-86.8688899
10/19/2022 19:00,Mulga,AL,USA,Changing,All week. 2-3 hours.,I have seen several that have appeared many nights in a row.,12/22/2022,,1513,"Mulga, AL",33.5498286,-86.9741612
10/19/2022 18:30,Tucson,AZ,USA,Triangle,45 seconds,Triangle Formation of 3 lights,12/22/2022,,1514,"Tucson, AZ",32.2539787,-110.9741769
10/18/2022 22:45,Rosenberg,TX,USA,Delta,Approx 25 minutes,A whitish Boomarang with a shimmering cloak,12/22/2022,,1515,"Rosenberg, TX",29.5571825,-95.8085623
10/18/2022 20:50,Waxhaw,NC,USA,Circle,40 seconds,I sit on my Front Porch every evening..,12/22/2022,,1516,"Waxhaw, NC",34.9245935,-80.7434019
10/18/2022 20:15,Chocowinity,NC,USA,Light,25 Minutes,Saw a big bright light that was zigzagging all over the place that ended up splitting into two and combining back into one.,12/22/2022,,1517,"Chocowinity, NC",35.5126631,-77.1005091
10/18/2022 20:00,Jacksonville,FL,USA,Chevron,15 seconds,5 blacked out aircraft in perfect formation flying north to south at approximately 500 feet at a speed of around 150 - 175 kts,12/22/2022,,1518,"Jacksonville, FL",30.3321838,-81.655651
10/18/2022 19:51,SAVANNAH,GA,USA,Triangle,2.00 minutes,I seen a tranlge ship moving about 20 miles per hour...,12/22/2022,,1519,"SAVANNAH, GA",32.0808989,-81.091203
10/18/2022 18:00,Hampden,MA,USA,Cigar,2 minutes,"Clear day, no engine sounds, did not have characteristics of a plane in the sunlight.",12/22/2022,,1520,"Hampden, MA",42.0639841,-72.4134167
10/18/2022 12:53,Sheboygan,WI,USA,Triangle,Very brief,Accidentally photographed a UFO when I was taking pictures of the waves,12/22/2022,Yes,1521,"Sheboygan, WI",43.7508284,-87.71453
10/18/2022 12:30,Gadsden,AL,USA,Unknown,Less than 25 seconds,"A visual distortion of objects in night sky buy ""cloaked"" object",12/22/2022,,1522,"Gadsden, AL",34.014264,-86.0066386
10/18/2022 7:25,Rancho Palos Verdes,CA,USA,Circle,5 minutes,"Line of 10 black, round objects (each approximately the size of a car) ascending quickly from the ocean to the clouds",12/22/2022,Yes,1523,"Rancho Palos Verdes, CA",33.7444613,-118.3870173
10/18/2022 5:14,Hayden,ID,USA,Circle,Less than 5 minutes,"Saw three bright lights hovering over an open field. Thought they were aircraft at first, but didn't move. Eventually faded/disappeared",12/22/2022,Yes,1524,"Hayden, ID",47.7660161,-116.7865815
10/18/2022 1:47,Zuni,NM,USA,Other,4 minutes,"Seen a unknown object changing shapes and colors. When inspecting the photos, we noticed several objects changing colors and shapes.",12/22/2022,Yes,1525,"Zuni, NM",35.0694767,-108.8484168
10/17/2022 22:48,Saint James,MO,USA,Unknown,5 min,"3 craft flying pallalel, no sound,",12/22/2022,,1526,"Saint James, MO",37.9972645,-91.6143224
10/17/2022 21:58,Seattle,WA,USA,Circle,About 5 minutes,This is the second time I’ve seen this bright orange dot in the sky..  ((NUFORC Note:  Lens flars.  PD)),12/22/2022,Yes,1527,"Seattle, WA",47.6062095,-122.3320708
10/17/2022 20:45,Sebring,FL,USA,Circle,30 seconds,3 bright white/yellow orbs in triangular shape appeared then dissappeared . i saw 5 us aircrafts chasing after it then it dissapeared,12/22/2022,,1528,"Sebring, FL",27.495592,-81.440907
10/17/2022 20:30,clearwater,FL,USA,Rectangle,10 minutes,"Bright Multi color lights Huge and Hovering, moving slow, then darted to south quickly out of view",12/22/2022,Yes,1529,"clearwater, FL",27.9658533,-82.8001026
10/17/2022 19:30,Avondale,AZ,USA,Circle,15 minutes,3 lights slowly moving south,12/22/2022,Yes,1530,"Avondale, AZ",33.4355977,-112.3496021
10/17/2022 19:10,Tarzana (Los Angeles),CA,USA,Fireball,2 seconds,"A large blue green fireball with a small tail north of Tarzana, CA",12/22/2022,,1531,"Tarzana (Los Angeles), CA",34.1494848,-118.5506158
10/17/2022 19:05,Pace,FL,USA,Unknown,1 minute,"Bright red light, smaller white light at rear, Niether light blinking. no sound",12/22/2022,,1532,"Pace, FL",30.5993603,-87.1610807
10/17/2022 16:00,tempe,AZ,USA,Circle,unknown,a big ball of light that shrank and rapidly change direction,12/22/2022,,1533,"tempe, AZ",33.4255104,-111.9400054
10/17/2022 15:00,Shawnee,KS,USA,Cone,5 minutes,Object woth vapor trail descending for 5 mins woth 2 jets nearby. Wife & I have pics.,12/22/2022,Yes,1534,"Shawnee, KS",39.0228485,-94.7151865
10/17/2022 6:30,Leominster,MA,USA,Disk,,Hovering then vanished i,12/22/2022,,1535,"Leominster, MA",42.5250906,-71.759794
10/17/2022 6:15,Georgetown,TX,USA,Light,3 minutes,"A stationary light. Bright like a star, moved and followed an airplane then took off",12/22/2022,,1536,"Georgetown, TX",30.6332618,-97.6779842
10/17/2022 5:45,Saint Charles,MO,USA,Triangle,3 seconds,I saw a triangle craft pass by me over head with lights shining directly down located on each corner. Triangle shape was clear.,12/22/2022,,1537,"Saint Charles, MO",38.7881062,-90.4974359
10/17/2022 1:11,Boise,ID,USA,Light,Maybe 1 or 2 seconds,What seemed like only a couple hundred feet above my house a bright neon green light the size of a minivan appeared and quickly darted,12/22/2022,,1538,"Boise, ID",43.6150186,-116.2023137
10/16/2022 22:55,Torrance,CA,USA,Fireball,30 seconds,Low hovering fireball,12/22/2022,,1539,"Torrance, CA",33.8358492,-118.3406288
10/16/2022 20:20,Boston,MA,USA,Cylinder,Several minutes,I spotted what I thought was a star but it was moving.,12/22/2022,Yes,1540,"Boston, MA",42.3600825,-71.0588801
10/16/2022 19:13,Columbus,OH,USA,Light,,Flying lights,12/22/2022,,1541,"Columbus, OH",39.9611755,-82.9987942
10/16/2022 19:11,DOYLESTOWN,PA,USA,Disk,2 minutes,Two people saw this,12/22/2022,Yes,1542,"DOYLESTOWN, PA",40.3101063,-75.1298939
10/16/2022 18:30,Paramus,NJ,USA,Oval,On and off for an hour,Captured video of ZIG ZAGGING blinking stars moving sporadically,12/22/2022,Yes,1543,"Paramus, NJ",40.9445428,-74.0754189
10/16/2022 17:00,Tempe,AZ,USA,Chevron,,Saw this boomerang shape object stationary high up in the sky.,12/22/2022,,1544,"Tempe, AZ",33.4255104,-111.9400054
10/16/2022 2:17,Evansville,IN,USA,Light,Maybe 30 seconds?,Loud noise hovering over my home with blinking lights,12/22/2022,,1546,"Evansville, IN",37.9715592,-87.5710898
10/16/2022 0:55,Bowie,MD,USA,Circle,30 seconds,"Light from flying object caused doorbell to issue ""Person Detected"" alert",12/22/2022,,1547,"Bowie, MD",39.0067768,-76.7791365
10/15/2022 23:20,Hastings,MI,USA,Disk,40 Seconds,A flying saucer with headlights flying low to the ground.,12/22/2022,,1548,"Hastings, MI",42.6458682,-85.2908403
10/15/2022 21:30,Bellevue,WA,USA,Disk,10-20 seconds,We saw a dark flying object in the night sky.,12/22/2022,,1550,"Bellevue, WA",47.6101497,-122.2015159
10/15/2022 21:18,Irving,TX,USA,Changing,,I originally thought it was a Satellite but the later I thought maybe it is possibly a UFO,12/22/2022,Yes,1551,"Irving, TX",32.8140177,-96.9488945
10/15/2022 21:15,poteau,OK,USA,Circle,10 seconds,atleast 50 circle flying in the skying a massive group moving how a school of fish would it had a reflective surface,12/22/2022,,1552,"poteau, OK",35.0537094,-94.6235579
10/15/2022 20:35,King,NC,USA,Formation,Only a few seconds.,I pulled up to the intersection at 8:35pm or so and spotted something in the sky for a few seconds then it disappeared.,12/22/2022,Yes,1553,"King, NC",36.2805336,-80.3593684
10/15/2022 20:29,Chesterland,OH,USA,Unknown,4 minutes,Super bright white flashing bright then dim kinda sparkling- but NOT a planet- not a meteor or aircraft.,12/22/2022,,1554,"Chesterland, OH",41.5222735,-81.3378874
10/15/2022 19:45,Asheville,NC,USA,Light,Maybe 15 seconds,A sign Gale moving light that would fade out and seem to reappear behind itself or maybe there were multiples.,12/22/2022,,1555,"Asheville, NC",35.5950581,-82.5514869
