,Date,City,State,Country,Shape,Duration,Summary,Posted,Images
179,9/21/22 22:00,Fayetteville,TN,USA,Circle,Approximately 3 min,"I was coming home , from about 200 yards away I saw what I thought was a Chinese lantern fl stationary roughly 30 to 50 feet above the.",10/8/22,
180,9/21/22 21:50,Waterbury,CT,USA,Light,No more than 10 minutes,"Flashing red/white lights - whirring sound when lights were 'on'/visible - no sound when lights were ""off""/not visible",10/8/22,
181,9/21/22 21:33,Brevard,NC,USA,Changing,Still continuing…,"Moves in erratic, zig zag and extremely fast motions, appearing and reappearing at unnatural distances.",10/8/22,
182,9/21/22 21:21,PORT WASHINGTON,NY,USA,Circle,2 minutes,Swirling hovering sound and a round object circling fast,10/8/22,Yes
183,9/21/22 20:52,Venice,FL,USA,Unknown,20 seconds,Observed unidentified flying object(s),10/8/22,
184,9/21/22 20:50,Naples,NY,USA,Fireball,12 minutes,Saw 5 objects the most I have ever seen in 1 night,10/8/22,
185,9/21/22 20:23,Las Vegas,NV,USA,Other,Approx. 30 second,Looking in sky to spot satellites,10/8/22,
186,9/21/22 19:42,Lapeer,MI,USA,Rectangle,A few seconds,Picture captured of something in sky,10/8/22,
187,9/21/22 19:31,San Marcos,CA,USA,Formation,4 minutes,"Two red lights in formation, roughly 400 feet apart, moving south close to horizon",10/8/22,
188,9/21/22 18:20,Lancaster,,USA,Formation,About 10 15 minutes,On or the night of September the 21st 2022 I was outside with my nabor and a row of lights aparoch in a 45% pattern,12/22/22,
189,9/21/22 14:35,Sacramento,CA,USA,Formation,15 minutes,Looked up and in distance at very high altitude we saw a group of 4 objects surrounding 1 object and 10 others in irregular line nearby,10/8/22,
190,9/21/22 12:30,Norristown,PA,USA,Light,A few minutes,Multiple flashing lights not in a line like starlink,10/8/22,
191,9/21/22 10:24,,,USA,Other,,"The Entity, that stood on the Tower.",10/8/22,
192,9/21/22 10:20,Osceola,IA,USA,Unknown,About a hour.,The UFOs flew over my apartment and picked up a car and dropped it.,10/8/22,
193,9/21/22 09:56,,,USA,Other,,"The old, woman.",10/8/22,
194,9/21/22 09:42,Manila,,Philippines,Sphere,20 mins,White spheres,10/8/22,Yes
195,9/21/22 05:10,The Woodlands/Spring,TX,USA,Chevron,10-15 seconds,Saw 3 lights in triangle shape move in “L” shape. Moved way too fast to be any airplane.,10/8/22,
196,9/21/22 03:05,Beverly Hills,CA,USA,Delta,2 to 5 minutes,Observed UFO flying West to East at a high rate of speed.,10/8/22,
197,9/20/22 23:06,Lincoln,NE,USA,Changing,From 11pm to 5am,"Watched 20 or more bright star like objects shapeshift, zig zag while looked at was night fishing. Saw them all night and many since",12/22/22,Yes
198,9/20/22 22:48,Rural/Not Applicable,WV,USA,Changing,1 minute 34 seconds,Smoking a cigarette and walking the dog in the yard late in the evening when I looked up and saw the object. Shot a video on an iPhone.,10/8/22,
199,9/20/22 22:02,Arlington,WA,USA,Light,2 minutes,Light seen in sky,10/8/22,
200,9/20/22 20:30,Virgin,UT,USA,Light,30 minutes,Three objects moving in the sky at the same time into different directions and able to go back to their previous location faster than h,12/22/22,
201,9/20/22 20:09,Westland,MI,USA,Light,,Seen a light hovering thought it was a plane but it went backward then shot forward,10/8/22,
202,9/20/22 20:00,Greenville,NC,USA,Unknown,1.5 hours,Orange/White light changing from extremely bright to nothing,10/8/22,
203,9/20/22 17:35,Shorewood,WI,USA,Sphere,5 Minutes,Two spherical objects flew over my house in a straight line from south to north,10/8/22,
204,9/20/22 05:46,West Milford,NJ,USA,Light,2 mins,"Bright white light, heading from northwest to southeast. Swerving flight path",10/8/22,
205,9/20/22 01:34,,,USA,Circle,1 minute,Unknown orb left visible trail on camera 2 minutes after initial photo,10/8/22,Yes
206,9/20/22 01:00,Phoenixville,PA,USA,Light,5 minutes,Indistinct object with rapidly changing lights of different colors sighted moving erratically in Phoenixville,10/8/22,
207,9/20/22 01:00,West Bloomfield,NY,USA,Unknown,20-30 minutes,"Slipping into bed when I noticed a distant bright which stopped, moved back, wiggled, and faded out",10/8/22,
208,9/19/22 23:20,,,USA,Circle,,"Shadowed beings,' with red glowing eyes.",10/8/22,Yes
209,9/19/22 22:07,Half Moon Bay,CA,USA,Light,3 seconds,"I saw two high-altitude soft cool light glows, one following the other which is exactly what I saw on the 9th of September of this year",10/8/22,
210,9/19/22 22:00,Lebanon,OR,USA,Light,15seconds,It flew into an invisible object.,10/8/22,
211,9/19/22 21:50,Ocean City,MD,USA,Formation,Approximately 10-15 mins,Red lights in the sky,10/8/22,Yes
212,9/19/22 21:32,Wexford,,Ireland,Circle,40 secondss,Flashing circular moving across the sky at rapid speed,10/8/22,
213,9/19/22 21:22,San Diego,CA,USA,Circle,11 Seconds,Mission Beach UFO,12/22/22,
214,9/19/22 21:15,between lindale texas and canton texas,TX,USA,Triangle,30 seonds,basically just a row of windows? traveling low and slow over the highway then just fading out.,10/8/22,
215,9/19/22 21:14,Saint Augustine,FL,USA,Circle,About 45 second,I thought it was Starlink at first but I zoomed in and noticed there was a dome in the center of the disc.,12/22/22,Yes
216,9/19/22 21:01,Vista,CA,USA,Changing,The past 15 minutes,"First there were 2 orange big lights, they disappeared and c/m and back smaller as 5 lights and were spinning in a circle",10/8/22,
217,9/19/22 21:00,Wilmington,NC,USA,Cigar,6 seconds,"it was a flying stick with large windows about 6 with white light coming out of the windows, it was flying fast and went quickly.",10/8/22,
218,9/19/22 20:55,Arcola,TX,USA,Formation,~12 seconds,Bright lights in a V or horseshoe formation that disappeared rapidly.,10/8/22,Yes
219,9/19/22 20:41,Ventura,CA,USA,Rectangle,30 secs,Ladder with lights,10/8/22,
220,9/19/22 20:28,Valdosta,GA,USA,Changing,,"Line moving very fast , lights then became a circle type then a sprial",10/8/22,
221,9/19/22 20:28,Dallas,GA,USA,Light,10 seconds,Multiple straight lights traveling low.  ((NUFORC Note:  Starlink satellittes.  PD)),10/8/22,
222,9/19/22 20:28,Summerville,SC,USA,Light,~60 seconds,"A string of 10 lights similar to the Earthlink, but much shorter, rotating together at an angle, then flickered out and disappeared.",12/22/22,
223,9/19/22 20:15,McCormick,SC,USA,Rectangle,one to two minutes,A string of rectangle e=devices in a straight line moving across the sky,10/8/22,
224,9/19/22 19:51,,,USA,Circle,,Shadowed Beings With Red Glowing Eyes,10/8/22,Yes
225,9/19/22 19:45,Lackawanna,NY,USA,Cigar,10min,Flashing light standing pretty still in the sky seemed to fade in and out,10/8/22,
226,9/19/22 19:31,Dothan,AL,USA,Cigar,10 seconds,It's was cigar 5 bright lights. I walked outside after a misunderstanding with my girlfriend. As soon as I got outside I looked up and,10/8/22,
227,9/19/22 19:15,Phoenix,AZ,USA,Light,20,Unexplained light over Southeastern Phoenix Metro,10/8/22,Yes
228,9/19/22 19:00,West Plains,MO,USA,Other,8 months,"Sighting first in Rolla then followed to St. Charles and West Plains, Mo.",10/8/22,
229,9/19/22 18:50,Champaign,IL,USA,Egg,About 1 minute,Was standing on my porch and looked up and saw this egg/cigar shaped bright object slowly moving across the sky. No sound no wings.,12/22/22,Yes
230,9/19/22 12:30,Fowler,CA,USA,Oval,12:30am to 4:30am,It keeps triggering my ring camera's.,10/8/22,
231,9/19/22 01:41,Jamestown,TN,USA,Light,2-3 minutes,Have 1:42 of mystery light within close proximity,10/8/22,
232,9/19/22 00:05,Winterport,ME,USA,Triangle,5 minutes,I saw one small Aircraft do what looked like a traffic pattern and another seem do a decent through the cloud layer.,10/8/22,
233,9/18/22 23:48,Fairbanks,AK,USA,Circle,Approx 10-12 seconds?,Saw a satellite then saw a light pacing behind it.,10/8/22,Yes
234,9/18/22 23:30,Palo Alto,CA,USA,Triangle,4 min,"Angular shaped vessel, bright lights surrounding it at the top.",10/8/22,Yes
235,9/18/22 22:01,Douglasville,GA,USA,Light,Watched for about 2 min,Flickering light red and white in color,10/8/22,
236,9/18/22 21:35,Sarasota,FL,USA,Changing,Maybe 2 minutes,"Unidentified orb-ish light, almost jellyfish/ stingray like",10/8/22,
237,9/18/22 21:18,Hot Springs Village,AR,USA,Triangle,,Bright lights shoots down at times,10/8/22,
238,9/18/22 21:00,Aventura,FL,USA,Changing,Ongoing for the past hour,"It’s between oval and square shape that keeps turning colors and intensity, on one same spot",10/8/22,Yes
239,9/18/22 20:58,London,London Borough of Islington,United Kingdom,Oval,About a minute or so.,I was standing in my balcony and say one light yellow like fire ball that’s moving then disappeared and appeared 2 and vanished,10/8/22,
240,9/18/22 20:20,Winter Park,FL,USA,Changing,4,This video shows an unknown space object.,12/22/22,
241,9/18/22 20:16,Boca Raton,FL,USA,Circle,12 seconds,On my nest during a storm I saw this,10/8/22,
242,9/18/22 19:40,Colorado springs,CO,USA,Sphere,40 seconds,A random white orb appeared in the sky and was moving very slow. No other lights were on it,10/8/22,
243,9/18/22 18:50,Santa Fe,NM,USA,Unknown,Seconds,Metallic object fell quickly out of sky at sharp trajectory. Could not determine shape. Appeared to move faster than terminal velocity,12/22/22,
244,9/18/22 14:43,"Neenach (Northern, Los Angeles County)",CA,USA,Unknown,20 sec. or less.,"vanishing military fighter jet/s, saw was vastly high rate of speed at shockingly low altituide then vanished. in clear view",12/22/22,Yes
245,9/18/22 12:13,andrews afb,MD,USA,Circle,about ten seconds,not sure how many witnesses round very bright about as bright as the sun,12/22/22,
246,9/18/22 02:46,Swansea,Wales,United Kingdom,Other,,Small light then disappeared,12/22/22,Yes
247,9/18/22 02:33,Everett,WA,USA,Unknown,8-15 seconds,UFO Does “loopty loop” then disappears,10/8/22,
248,9/18/22 00:20,Henrietta,NY,USA,Circle,~1 second,"circle craft came out from the area where the moon was,flew down and to the left incredibly fast,then quicky dropped below the treeline",10/8/22,
249,9/17/22 23:58,Stephenville,NF,Canada,Cylinder,Not sure,3 Crafts Over Home,10/8/22,Yes
250,9/17/22 23:37,Las Vegas,,USA,Triangle,Approximately 4 seconds,V Shaped UFO with white bright light under each side,10/8/22,
251,9/17/22 21:35,Coon Rapids,MN,USA,Circle,3 minutes,"Green pulsating Light, moving sporadically, changing directions. Stopping near a bright visible star",10/8/22,Yes
252,9/17/22 21:32,Milwaukee,WI,USA,Fireball,about 15 seconds,"Fireball over Lake Michigan, silent, changing direction before disappearing into clouds",10/8/22,
253,9/17/22 21:27,Charlotte,NC,USA,Diamond,2 minutes,Sitting with my mom and sister on my deck in my backyard and saw a blinding diamond shaped light for roughly two minutes.,10/8/22,
254,9/17/22 20:52,Washington,VA,USA,Light,Approximately 35 minutes,2 lights synchronized side by side darting in the sky and occasionally come together and then repeat side by side,10/8/22,
255,9/17/22 20:28,Deland,FL,USA,Triangle,5-6 minutes,I was filming the launch of the SpaceX capsule and saw the Object below the space X rocket,10/8/22,Yes
256,9/17/22 20:18,Troy,MI,USA,Circle,1 minute,Round bright object hovering at dusk,10/8/22,
257,9/17/22 20:00,Hummelstown,PA,USA,Light,Approximately 10 minutes,Cluster of red moving lights,10/8/22,
258,9/17/22 19:28,Aberdeen,SD,USA,Fireball,Hours,"Its came, floated around and slowly faded",10/8/22,Yes
259,9/17/22 17:45,Turner,ME,USA,Oval,2 Minutes or more,"Silent, high altitude fast moving.",10/8/22,
260,9/17/22 16:50,Frome,Somerset,United Kingdom,Changing,about 2 mins,It was very high in the sky and the sky was clear.,10/8/22,Yes
261,9/17/22 13:40,Provo,UT,USA,Sphere,5 minutes,"Witnessed a spherical object hovering motionless 2000' in the air. After several minutes it made a rapid, controlled descent.",10/8/22,Yes
262,9/17/22 03:00,Hauser Lake,ID,USA,Triangle,30 seconds,I had an interaction with a black triangle,12/22/22,Yes
263,9/17/22 02:20,,,,Circle,,Entitys that are shadowed silhouettes some are transparent with entirely bright blood red glowing eyes and the entitys have powers,10/8/22,Yes
264,9/17/22 00:15,Cliffside Park,NJ,USA,Light,Approx 5 minutes,"Bright light extending from dark cloud formation over river, moving very slowly and deliberately",10/8/22,
265,9/16/22 23:45,Waterford,ME,USA,Light,>25 minutes,"Light about the size of a satellite, moving Side to side, up and down, small circles, and figure eights",10/8/22,
266,9/16/22 23:30,Pearl city,HI,USA,Cylinder,Thirty minutes,Moving across the sky above pearl city hawaii,10/8/22,
267,9/16/22 22:00,Ridley Park,PA,USA,Cylinder,1.5 hours,At least 3 crafts circling PA NJ DE area,10/8/22,
268,9/16/22 21:46,Napa,CA,USA,Light,45 seconds,IFO sighting SF Bay area,10/8/22,
269,9/16/22 21:30,Vassalboro,ME,USA,Circle,2-3 mins,9 objects over few minutes time,10/8/22,
270,9/16/22 21:09,Downtown St. Louis,MO,USA,Fireball,2 minutes,Orange Reddish Fireballs Multiplying,10/8/22,
271,9/16/22 21:01,Schenectady,NY,USA,Circle,Approximately 6 minutes,Glowing balls that looked like round fireballs travelling one minute behind each other going in the same direction.,10/8/22,
272,9/16/22 21:00,St Louis,MO,USA,Fireball,About 5 min is all I saw,"4 fireballs falling merged into 1, than split into 4 and left 5th ball behind stationary. Than the 4 stopped falling and 2 more appeare",10/8/22,
273,9/16/22 20:30,Wrightsville Beach,NC,USA,Sphere,2 minutes,"Spotted 2 UFOs, one white one red & white, above Wrightsville Beach",10/8/22,Yes
274,9/16/22 20:30,Wrightsville Beach,NC,USA,Changing,2 minutes,"*Update* 2 UFOs Spotted Fri 9/16/22 @8:30PM Over Wrightsville Beach, NC",10/8/22,
275,9/16/22 20:20,Silver Bay,NY,USA,Light,3 minutes,3 lights in a row moving same speed,10/8/22,
276,9/16/22 20:10,Lamoille Canyon,NV,USA,Light,1 to 2 minutes,I have a video. It moved down and over then stopped then moved again and stopped then disappeared.,10/8/22,
277,9/16/22 20:00,Springfield,NH,USA,Triangle,Approximately an hour,Sitting at a campfire in front yard. A guest noticed an triangle shaped area of the sky with no stars showing.,10/8/22,
278,9/16/22 16:30,Silver Bay,NY,USA,Cigar,Clear view approx 7 minu,"I was out on the point for a wedding rehearsal, and I noticed something shimmering in sky.",10/8/22,
279,9/16/22 07:00,Asheville,,,Circle,45 minutes,Large circle of lights,10/8/22,
280,9/16/22 06:10,Coweta,OK,USA,Circle,1 or 2 minutes,"Very fast moving bright circular craft that made no sound coming out of the west, flew overhead and faded to a dull hew then vanished",10/8/22,
281,9/16/22 00:05,Irvington/Newark border,NJ,USA,Circle,30-60 seconds,Seen hovering on a residential street before passing slowly diagonally over houses,10/8/22,
282,9/15/22 22:45,China,ME,USA,Light,2 minutes,"Two solid lights moving in unison, one fluctuating in luminosity.",10/8/22,
283,9/15/22 22:39,De Pere,WI,USA,Light,5 seconds,"Blue light that rapidly grew, broke off into 3, ""fell"" a small bit, and disappeared",10/8/22,
284,9/15/22 22:37,Arlington Heights,IL,USA,Chevron,1 second,while driving saw a neon green long rectangular object with a pointed end heading towards the southwest,10/8/22,
285,9/15/22 21:49,Marysville,OH,USA,Light,16 seconds,"Bright ""white sparking"" lights really high in night sky.",10/8/22,
286,9/15/22 21:40,North Las Vegas,NV,USA,Light,3 minutes,Set of three bright white lights moving in formation,10/8/22,
287,9/15/22 21:10,Woonsocket,RI,USA,Circle,30 minutes,Semi circle of lights hovering,10/8/22,Yes
288,9/15/22 21:00,Mount Pleasant,TX,USA,Circle,About 2-3 minutes total,First dot making triangular patterns. The next two criss crossed straight lines. The final one flew west in a straight line,10/8/22,
289,9/15/22 20:58,Mayville,WI,USA,Other,3 seconds,Saw a faint red lit dark object move very fast in a non linear manner and disappear rapidly all within 3 seconds or so.,10/8/22,
290,9/15/22 20:04,Amherst,MA,USA,Light,,2 of them were extremely bright white lights with halos they were approximately a mile up and moving about 300-400 mph.,10/8/22,
291,9/15/22 20:00,Kiawah Island,SC,USA,Circle,Hour or more,Noticed a reddish circular object in the sky that appeared at to be moving and then seemed to hover.,10/8/22,Yes
292,9/15/22 19:06,Gharbia in the nile delta,Gharbia Governorate,Egypt,Fireball,4 minutes,Bright light object same speed as iss,10/8/22,
293,9/15/22 17:15,Morris Plains,NJ,USA,Circle,15,Filmed a craft that disappeared and reappeared,10/8/22,Yes
294,9/15/22 15:00,Loranger,LA,USA,Cigar,20 seconds,"Clear sunny day , Flying Southwest over Hammond Airport on Louisiana",12/22/22,
295,9/15/22 13:05,Thornton,CO,USA,Circle,4-5 seconds,I witnessed a group of 6 or 7 golden objects move across the sky & as I tracked them they came together as one and disappeared.,10/8/22,
296,9/15/22 13:00,Hwy 71 between maryville - saint joeseph,MO,USA,Triangle,,Weird big black triangle hovering craft,12/22/22,
297,9/15/22 10:10,Luttrell-manerdville,TN,USA,Cylinder,Slow speed apx 10min,"It was slow moving, top and bottom flashing white lights",10/8/22,
298,9/15/22 09:30,Apopka,FL,USA,Other,5 - 10 minutes,"I have photos. Also, there was a rocket launching immediately after the sighting, but there were no scheduled rocket launches, today.",10/8/22,Yes
299,9/15/22 04:50,Milan,MI,USA,Triangle,10 seconds,Flew right over the road,10/8/22,
300,9/15/22 03:14,Mansfield,MA,USA,Light,Every night,UFOS OVER MY HOUSE EVERY NIGHT. GOVERNMENT DRONES CIRCLING,10/8/22,
301,9/15/22 00:01,South Dennis,MA,USA,Other,1 minute,2 sets of blinking red lights pass very close to eachother,10/8/22,
302,9/14/22 21:30,Ellabell,GA,USA,Changing,ongoing,Third time we gave witnessed these UAPs,10/8/22,
303,9/14/22 21:30,Berwyn,PA,USA,Cylinder,seconds,"Long line of white light moving quickly and grew a large circle on the front end then poof, disappeared.",10/8/22,
304,9/14/22 21:30,Furteventura - Costa Calma beach,,Spain,Light,10 minutes,We saw a green flashing orb like light moving at rapid spees,10/8/22,Yes
305,9/14/22 20:11,Mt Charleston,NV,USA,Light,30 seconds,"Brighter than any star, moving what looked like faster than any aircraft",10/8/22,
306,9/14/22 20:09,Chico,CA,USA,Sphere,5 mins,I looked up to see a blue orb/sphere traveling slowly in the sky it was shooting other orbs out of it and even moved closer,12/22/22,
307,9/14/22 20:00,Gulf Shores,AL,USA,Light,Over a span of 20 minutes,"lights splitting, dividing, and then disappearing.",10/8/22,
308,9/14/22 19:30,Baldwin,FL,USA,Light,An hour or 2?,bright orb of light then big aircraft followed. Then I seen what looked like to be a rocket launch. Then the orb&aircraft chased,10/8/22,
309,9/14/22 18:25,Lake Tapps WA 98391,,USA,Sphere,2 minutes,"orbs spinning and colliding into each other, shooting out tinier white orbs.",10/8/22,Yes
310,9/14/22 14:00,Barrow-in-Furness,Cumbria,United Kingdom,Oval,Not known,Walking back from Walney Island nature reserve i noticed a flash above the B.A.E.building which was too distant to see objects,12/22/22,
311,9/14/22 09:20,Duluth,GA,USA,Other,1 hour,Saw it come off the moon or appeared to and watched it slowly move a ross the sky left of the moon then it just stayed put hovering,10/8/22,Yes
312,9/14/22 07:08,Corydon,IN,USA,Triangle,45 minutes to an hour,We were rounding a 90% turn on a small country road and they were waiting as we came out of the sharp turn,10/8/22,
313,9/14/22 06:00,Tamarac,FL,USA,Light,5 m,Walking my dog in the morning,10/8/22,
314,9/14/22 00:01,Urjala,,Finland,Unknown,My life,Rape,10/8/22,
315,9/13/22 23:32,Largo,FL,USA,Triangle,10-15 seconds,Black triangle craft with 3 dull white lights at each point,10/8/22,
316,9/13/22 22:00,Pawley's Island,SC,USA,Light,10 seconds,Group sees an ornage light eject multiple other lights,10/8/22,Yes
317,9/13/22 21:32,Duluth,MN,USA,Rectangle,Maybe in 5 min,Bright orange light in the sky is wat caught my attention,10/8/22,Yes
318,9/13/22 21:30,Myakka City,FL,USA,Light,5 minutes,As it moved over very slowly it had a weird forward movement.,10/8/22,
319,9/13/22 21:17,Aiken,SC,USA,Light,15 minutes that I saw,"Changed colors, moved erratically",10/8/22,
320,9/13/22 21:10,Chester Springs,PA,USA,Diamond,10 minutes,A very bright light moving very erratic,10/8/22,
321,9/13/22 21:05,Manchester,Lancashire,United Kingdom,Star,3-4 minutes,Fast to slow moving,10/8/22,
322,9/13/22 20:55,Walnut Creek,CA,USA,Triangle,17 seconds,Black triangle hovering silently approximately 100 ft above ground,12/22/22,
323,9/13/22 20:43,Dover,DE,USA,Light,4-5 minutes,Ball of light,10/8/22,
324,9/13/22 20:10,Mesa,AZ,USA,Light,10 min,Stationary Flashing Bright Green Light,10/8/22,Yes
325,9/13/22 20:05,Paulsboro,NJ,USA,Disk,2 minutes,A craft that turns invisible,10/8/22,
326,9/13/22 19:57,Farmington,MO,USA,Fireball,2 Minutes,As I watched if go past the field across the street I shined a light at it and the ufo’s light dimes and vanished,10/8/22,
327,9/13/22 19:27,Chandigarh,Chandigarh,India,Circle,More than 30 seconds.,Similar to a shining star and going in a straight line.,10/8/22,
328,9/13/22 19:10,Manchester,Lancashire,United Kingdom,Oval,10 minutes,I was looking up at an aircraft high up in the atmosphere flying along leaving a vapour trail.,10/8/22,
329,9/13/22 06:59,Naples,FL,USA,Changing,7 to 10 min.,Noticed an orb to the right of the moob,10/8/22,
330,9/13/22 05:05,Prosper,TX,USA,Circle,About 10 minutes,oscillating sphere in sky sparkled various color blueish and slight red,10/8/22,Yes
331,9/13/22 00:01,Baldwin Park,CA,USA,Changing,Still out there,Weird lights like orbs changing,10/8/22,
332,9/12/22 22:32,California,PA,USA,Unknown,Over 30 minutes,There were 3 in the shape of a triangle and one circling around it like a fly in smooth motions but not like a plane.,10/8/22,Yes
333,9/12/22 22:30,Mount Vernon,KY,USA,Disk,15 minutes,Rotating disk,10/8/22,
334,9/12/22 22:30,Windsor,,Canada,Cigar,5-10 seconds,A unknown object flying very low. Had no wings and was as loud and fast as a jet,10/8/22,
335,9/12/22 22:05,Thomaston,CT,USA,Disk,2 seconds,We saw a large ship completely lit up moving at an impossible speed across the sky for 2 seconds,10/8/22,Yes
336,9/12/22 22:00,Kiowa,CO,USA,Light,All night,Several Bright lights in the sky. Float and will move closer.,10/8/22,
337,9/12/22 21:19,Garson,ON,Canada,Triangle,60 to 90 seconds,"Two triangular craft moving silently in a southerly direction towards my location, then westward up and out of sight. Velocity unknown.",10/8/22,Yes
338,9/12/22 21:15,Fairport,OH,,Circle,20 seconds,Thought it was a shooting star till I looked at video,12/22/22,
339,9/12/22 19:55,North Chesterfield,VA,USA,Fireball,It is a still shot,It looks like something entering the atmosphere two objects glowing green,10/8/22,Yes
340,9/12/22 15:30,Isle of Mull,Argyll and Bute,United Kingdom,Star,10 minutes,Unexplained fling object in sky.,10/8/22,Yes
341,9/12/22 13:15,Flushing,NY,USA,Unknown,5 minutes,Craft,10/8/22,Yes
342,9/12/22 09:25,Mount Airy,NC,USA,Disk,Around 30 seconds,Strange object flying in a field.,10/8/22,
343,9/12/22 04:31,San Diego,CA,USA,Unknown,~5-7 minutes,Not clusters from starlink satellites nor aircraft but very high and nearby flying and all emitting light. Came close then parted .,10/8/22,
344,9/11/22 23:22,Monks Corner,SC,USA,Oval,greater than 10 minutes,"an oval, double disk, with green & red lights lights appeared near full moon and Jupiter.",10/8/22,
345,9/11/22 21:30,Lakeville,MN,USA,Sphere,13-15 seconds,Spherical Object UFO Sighting,10/8/22,
346,9/11/22 21:16,Lubbock,TX,USA,Chevron,30 seconds,"V-shaped object with about 8-10 dim white lights passed southbound directly over Lubbock, Texas.",10/8/22,
347,9/11/22 20:35,Thornton,CO,USA,Circle,"a few minutes, 3 passes",4 orange shapes moving through the night sky,10/8/22,
348,9/11/22 20:30,Miami Beach,FL,USA,Triangle,3-4 min,"1craft was definitely triangle, the other was just a bright light.",10/8/22,
349,9/11/22 20:23,Dubai,Dubai,United Arab Emirates,Light,spotted in photo only,I took a photo of moon. Spotted something on left side in that photo,10/8/22,Yes
350,9/11/22 20:09,waterville,ME,USA,Light,approximately 7 secs.,we observed a red light appeared descending downward then changed to green/blue then ascended about 5 ft above the building and faded,10/8/22,
351,9/11/22 19:50,Oilton,OK,USA,Changing,Approximately 15 seconds,The object seemed to change shape and was a single light,10/8/22,Yes
352,9/11/22 19:05,Albuquerque,NM,USA,Cylinder,About 1 minute,Black donut shaped craft,10/8/22,
353,9/11/22 18:20,Tuttle,OK,USA,Triangle,1 min.,Very large metal shinning the reflection of sun triangle UFO.,10/8/22,
354,9/11/22 18:20,Molino,FL,USA,Cigar,Appx five minutes,Looking out to the West sky a large iridescent bright UFO moving slowly across the sky,10/8/22,
355,9/11/22 17:58,Waterbury,CT,USA,Sphere,50 seconds,Very large orange orb .it went dark and at point its was only visible with the phone camera not the naked eye,10/8/22,Yes
356,9/11/22 12:16,Jericho,NY,USA,Changing,Approx. 10-15 minutes,Looking up in the parking lot,10/8/22,
357,9/11/22 07:20,Anoka,MN,USA,Disk,12 minutes,I witnessed a suspicious aircraft in air and captured it on video.,10/8/22,Yes
358,9/11/22 06:02,Riviera Beach,FL,USA,Cigar,45 seconds,Bright yellow orange cigar or cylindrical object appeared at the horizon.,10/8/22,Yes
359,9/11/22 05:30,palm bay,FL,USA,Cigar,8mins,very large craft cigar shape,10/8/22,Yes
360,9/11/22 05:20,North Topsail Beach,NC,USA,Cylinder,20 seconds,Large and easily seen in vertical position covered on white lights like dots,10/8/22,
361,9/11/22 05:14,,GA,USA,Star,At least 10 minutes,"Ball of light accelerating and decelerating, matching speed with my vehicle",12/22/22,
362,9/11/22 00:30,Hartselle,AL,USA,Sphere,1hr 30min,"Two very bright bright white spheres one more so than the other. Both shape shifted. One to the west, and one adjacent to the moon",10/8/22,Yes
