,Date,City,State,Country,Shape,Duration,Summary,Posted,Images
363,9/10/22 23:00,Saint peters,MO,USA,Triangle,15 minutes,Bright triangle shape flying around,10/8/22,Yes
364,9/10/22 23:00,Quincy,IL,USA,Light,Hour,Got a still video picture of our star gazing.,10/8/22,Yes
365,9/10/22 22:45,Umatilla,FL,USA,Fireball,1 minute,Fireball flying upwards in the sky,10/8/22,
366,9/10/22 21:10,Lake City,FL,USA,Circle,Roughly one minute,"Looking South,Southeast wait for Space X to launch",10/8/22,
367,9/10/22 20:36,Oak Grove,AR,USA,Light,3 Seconds,A bright yellow light formed above the tree line and shot straight up and disappeared.,10/8/22,
368,9/10/22 20:01,Gatineau,Quebec,Canada,Disk,about a quarter second,"An upward facing infrared camera captured a classically shaped UAP moving left to right, inexplicably out of focus",12/22/22,Yes
369,9/10/22 20:00,Outer Benson/ Texas Canyon/ Sibyl,AZ,USA,Fireball,Hours,Very large portion off mountain glowing will not believe when we got closer!,10/8/22,Yes
370,9/10/22 20:00,Skykomish,WA,USA,Light,3 minutes,Red orb photographed slowly moving west at about 300',12/22/22,Yes
371,9/10/22 19:30,WESTLAKE,OH,USA,Light,1-2 s,Fast large lights in night sky,10/8/22,
372,9/10/22 18:41,Castle Rock,WA,USA,Cross,1 minute video,Took a video of the sun against the smokey sky and saw a quick black object,10/8/22,Yes
373,9/10/22 18:20,Owensboro,KY,USA,Formation,10 minutes,Cluster formation erratic movement and finally came to standstill and consolidated,10/8/22,
374,9/10/22 13:35,Cocoa Beach,FL,USA,Changing,photos of a ufo over NASA,We didn’t see it in the sky. No sound. No one on the beach seemed to notice.,10/8/22,Yes
375,9/10/22 06:25,Logan Township,NJ,USA,Changing,1 minute,I looked up toward South West and I though I saw a plane but there was no sound. I grabbed my phone and started shooting.,12/22/22,Yes
376,9/10/22 01:00,Saint Peters,MO,USA,Unknown,"10 minutes, maybe longer",Bright light surrounded by light orb moving in zigzags and swirls slowly & quickly. Stopped quickly. Stayed perfectly still at times.,10/8/22,
377,9/9/22 22:10,Ocean City,NJ,USA,Changing,Observed for 10 minutes,Observed an object alternating Red and Green light,10/8/22,
378,9/9/22 21:20,coeur d alene,,USA,Light,About 5 minutes,I saw it flashing light on and off slowly .then it started to go red and green.,10/8/22,
379,9/9/22 20:15,Evansville,IN,USA,Triangle,Around 2 minutes,2 objects came from east to west.,10/8/22,
380,9/9/22 19:34,Edmond,OK,USA,Other,5 to 7 minutes,"Very bright white, much slower that a jet",10/8/22,
381,9/9/22 19:12,Juazeiro Do Norte,Ceará,Brazil,Circle,5-10 minutes,The circle was moving onto my right,10/8/22,
382,9/9/22 19:05,plymouth,,United Kingdom,Circle,,took a picture of the sun rising only saw the dot to the right of tge photo. zoomed in and this is what I saw,10/8/22,Yes
383,9/9/22 18:58,Laurel,MS,USA,Oval,20,Onject as bright as the sun.,10/8/22,
384,9/9/22 18:55,Libertyville,IL,USA,Other,,Corner of Rockland Rd and Milwaukee Ave on Sept 9 2022 at approximately 6:55pmin in Libertyville IL,10/8/22,
385,9/9/22 17:45,"Chicago , montrose harbor",IL,USA,Triangle,20 min,Three pointed star fish shaped craft with fire underneath very high above airlines coming in over the lake stood there and did not move,10/8/22,
386,9/9/22 14:28,Los Lunas,NM,USA,Oval,3 Minutes,Amazing close-up photo of this aerial phenomena,10/8/22,Yes
387,9/9/22 06:00,Huntington Beach,CA,USA,Circle,2 minutes,Having coffee in my back yard,10/8/22,
388,9/9/22 02:15,Los lunas,NM,USA,Oval,3min,You better check out my photo it’s pretty good,10/8/22,Yes
389,9/9/22 01:09,Pearl City,HI,USA,Star,Several minutes and years,Saw the crafts moving across sky.,10/8/22,
390,9/9/22 00:30,Bradenton,FL,USA,Star,Around four hours,They come from all directions to one location then head out in a group,10/8/22,
391,9/9/22 00:11,East Stroudsburg,PA,USA,Star,60 seconds,Two stars moving slowly one got very bright then both disappeared,10/8/22,
392,9/8/22 21:00,Mount Joy,PA,USA,Light,Approximately 10 minutes,3 or 4 lights moving at high speeds,10/8/22,
393,9/8/22 21:00,Fyffe,AL,USA,Circle,Still in sky,Spinning circular with red n yellow flashing lights,10/8/22,
394,9/8/22 20:43,Kearney,MO,USA,Light,3 mins,An unusual flashing light,10/8/22,
395,9/8/22 20:40,Taunton,MA,USA,Other,30 seconds,I saw a crescent shaped yellow white object spinning downward then it faded into the sky,10/8/22,
396,9/8/22 19:58,Farmington,MO,USA,Star,3 minutes,Bright yellow Light moving at steady speed across field.,10/8/22,
397,9/8/22 18:20,Lancaster,PA,USA,Sphere,Around 7 seconds,White Sphere,10/8/22,
398,9/8/22 08:30,Palm Beach Gardens,FL,USA,Sphere,5 mins,glowing disk surrounded by a white aura and moving slowly,10/8/22,Yes
399,9/8/22 06:25,Jamaica,VA,USA,Star,10 minutes,Saw one stationary star-shaped object and two others that disappeared when I glanced at them.,10/8/22,Yes
400,9/8/22 06:24,Griffin,GA,USA,Unknown,1 1/2 hours,I zoomed in on the picture & captured the real image that was hovering over the neighborhood.,12/22/22,Yes
401,9/8/22 04:30,Reading,PA,USA,Circle,1 hour,This was pulsing multi colored lights,10/8/22,
402,9/8/22 01:30,Gatlinburg,TN,USA,Disk,15 mins,Bright round light appeared and disappeared shot into atmosphere then a bolt of lightning lit up sky,9/9/22,
403,9/7/22 23:13,Manhattan,NY,USA,Changing,9:00pm~through 2:00 am,Irrefutable,10/8/22,Yes
404,9/7/22 23:00,andrews,NC,USA,Changing,we watched for 30 minutes,my sister and i both videoed at the same time,10/8/22,Yes
405,9/7/22 19:45,Mobile,AL,USA,Light,10 minutes,"Red lights one after the other, quiet following same pattern in sky from north to east. Three at one time side by side then single fil",10/8/22,
406,9/7/22 19:30,Pendleton,OR,USA,Light,60 seconds,"Bright light over a hill around twilight. Thought was star or venus but it moved straight up at a steady pace, almost like a distant r",10/8/22,
407,9/7/22 17:15,Salford,,United Kingdom,Disk,Minute or two,Metallic disc spotted below heavy clouds,10/8/22,Yes
408,9/7/22 08:10,Wappingers falls,NY,USA,Cigar,3 minutes while deiving,Large cigar shaped object made up of 5 or 6 spheres,9/9/22,Yes
409,9/7/22 06:35,Ft Lauderdale,FL,USA,Circle,A split second,Huge ufo craft above,10/8/22,Yes
410,9/7/22 06:35,Miramar,FL,USA,Oval,A split second,at a red light,10/8/22,Yes
411,9/7/22 05:50,Mount Maunganui,Bay of Plenty Region,New Zealand,Light,16 seconds,"8 quarter sized orange/white balls of light, one at a time appeared in 2 second intervals between them, one at a time.",10/8/22,
412,9/7/22 05:00,Tucson,AZ,USA,Formation,2 -3 mins,a straight line of 70-100 (maybe more) lights in the sky moving silently,9/9/22,
413,9/7/22 03:30,Tehachapi,CA,USA,Triangle,From 3:30 am to 530 am,I saw what I thought was a very bright and close airplane but it was not moving.,10/8/22,Yes
414,9/7/22 00:00,Richmond,VA,USA,Sphere,1-2 seconds,"A bright white object appeared in the sky, then shot straight up into the air leaving a bright tail, then everything disappeared.",9/9/22,
415,9/6/22 23:45,Brookhaven,GA,USA,Cylinder,Slow and low maybe 1 min,Very low flying large object. You could hear a hum. Rounded nose cylindrical slight flare near tail. Belly was dark with white area.,9/9/22,
416,9/6/22 23:44,Los Gatos,CA,USA,Oval,3 seconds,White high-speed tik-tak seen in night sky.,9/9/22,
417,9/6/22 22:25,Midland,TX,USA,Fireball,45 seconds to 1 minute.,I noticed NE of my house an orange ball of light headed SW.,9/9/22,
418,9/6/22 22:00,Glenn’s ferry,ID,USA,Light,Approximately 5-8 minutes,"Several lights, that lit up one at a time, flew up, dimmed out..NOT STARLINK",9/9/22,
419,9/6/22 21:30,Rogersville,TN,USA,Light,10min,"we have 10min video but i cant send it says to big (33mb), i downloaded to laptop from phone on itunes",10/8/22,
420,9/6/22 20:11,Chokio,MN,USA,Light,5-7 mins,Fireball looking thing appeared on the west sky,10/8/22,Yes
421,9/6/22 19:51,Arches National Park,UT,,Other,15 minutes,I filmed a white comet shaped object moving very slowly in the sky,10/8/22,Yes
422,9/6/22 19:44,Huntington Beach,CA,USA,Light,2 minutes,Sitting in my back yard and noticed a light coming out of the clouds.,10/8/22,
423,9/6/22 19:42,Santa Moinca,CA,USA,Diamond,8 seconds,"4 white lights in a diamond shape, expanded, contracted and flew towards the ocean.",10/8/22,
424,9/6/22 19:40,Lago vista,TX,USA,Circle,20-25 minutes,Was near the house again,9/9/22,
425,9/6/22 19:10,PRICE,UT,USA,Rectangle,about two minutes,"UFO Sighting by two 5th graders - large square shape, erratic movements, in evening sky above Price Utah",9/9/22,Yes
426,9/6/22 04:40,Santa Monica,CA,USA,Circle,30 minutes,I spinning craft that was hovering for a long time with unusual bursts of light and changing colors,9/9/22,Yes
427,9/6/22 04:40,Santa Monica,CA,USA,Circle,30 minutes,I took videos and photos of a ufo that was spinning and hovering with unusual lights that changed color and bursted,9/9/22,Yes
428,9/6/22 03:20,Phoenix,AZ,USA,Formation,2 to 3 seconds,Saw at least 15 orange/yellow ball of light (may be more) formed together moving horizontally,9/9/22,
429,9/6/22 02:36,Rocklin,CA,USA,Rectangle,2 minutes,Object changed from half Oval to Rectangle.,10/8/22,
430,9/6/22 01:25,Irvine,CA,USA,Light,minute or two,Big light in the sky changing colors.,9/9/22,Yes
431,9/6/22 01:18,Huntington Beach,CA,USA,Star,5 minutes,It came from SW Direction heading NE with wrapping flashing lights that change colors every so often.,10/8/22,
432,9/6/22 01:18,Huntington Beach,CA,USA,Light,Five minutes,Rapid blinking of light,10/8/22,
433,9/5/22 22:30,Middletown,OH,USA,Light,"30 seconds, maybe less","Incredibly bright flash, small sphere of light in distant sky streaks off",10/8/22,
434,9/5/22 20:00,,CA,USA,Formation,well over 5 minutes,We saw in the sky a formation of lights which made a triangular pattern moving slowly across the sky from east to west.,9/9/22,
435,9/5/22 16:41,,,USA,Other,12 seconds,Unknown object flys at my drone along waterway,10/8/22,
436,9/5/22 15:58,Mendenhall Glacier,BC,Canada,Cone,,We didn’t notice these Orbs until we was looking at the pictures of our cruise to Alaska.,10/8/22,Yes
437,9/5/22 13:00,Near Portland,OR,USA,Oval,30 seconds,Saw a fast flying oval not far from where I was.,9/9/22,
438,9/5/22 12:51,??,NC,USA,Cigar,5 minutes,"Was on jetblue going to Florida. Was at 30,000 feet in the air.",12/22/22,Yes
439,9/5/22 12:45,Friday harbor,WA,USA,Light,3 seconds,UFO appears briefly behind a high altitude south bound jet.,9/9/22,
440,9/5/22 10:42,Indiatlantic,FL,USA,Circle,"Photo, unknown at time ta","Mom took a photo and unknown to her at the time, people were looking at an unidentified object",12/22/22,Yes
441,9/5/22 06:13,Satsuma,FL,USA,Cylinder,A minute or two I'm guess,Cylindrical object spotted while sky watching.,12/22/22,Yes
442,9/5/22 06:12,Casper,WY,USA,Cigar,2min.,"White, glowing cigar shaped object",9/9/22,
443,9/5/22 05:15,Lees Summit,MO,USA,Other,around 5 to 7 minutes,Lights in Sky,9/9/22,
444,9/5/22 05:13,Foley,AL,USA,Rectangle,Two minutes,Non-moving rectangular row of lights,9/9/22,Yes
445,9/5/22 05:00,Wadebridge Cornwall,Cornwall,United Kingdom,Circle,1 minute,Star like objects traveling at speed behind a circular shaped cloud.,9/9/22,
446,9/5/22 04:41,Gardnerville,NV,USA,Cigar,45 seconds approx,"Cigar shaped, translucent, moving white lights. Moving west to east on a very northern horizon. Able to take 2 photos.",10/8/22,Yes
447,9/5/22 04:41,Burnsville,MS,USA,Other,Thirteen seconds,I was just flying my drone over the waterway in Burnsville and noticed nothing unusual until later on when going through videos.,12/22/22,
448,9/5/22 04:15,Dartmouth,MA,USA,Cigar,5-10 minutes,Long bright light Almost stationary then moving at a steady pace.,9/9/22,Yes
449,9/5/22 03:15,Newnan,,Georgia,Sphere,I saw it on the ground,I saw it flying over my car the Frist time I was going to work then the next day I saw it again that when I got my mom to come see it,10/8/22,Yes
450,9/4/22 23:30,Mondovi,WI,USA,Circle,30 min,"Light above trees moving erratically, but also purposefully. We watched the craft ascend and descend and fly circles around the treetop",9/9/22,
451,9/4/22 22:48,Apple valley,CA,USA,Light,2 seconds,Recorded bright glowing craft shoot up from ground at an angle to the clouds and then level off at high rate of speed,9/9/22,
452,9/4/22 22:25,Wilmington,NC,USA,Circle,1 minute,Bright orange fire ball like light falling from sky then light disappears completely. Look left and see a silver disc moving slowly,9/9/22,
453,9/4/22 22:24,Louisburg,NC,USA,Other,About one minute,Kind of a V shape with a dull orange glow. It was very large and slowly moving.,9/9/22,Yes
454,9/4/22 22:20,Wilber-By-the-Sea,FL,USA,Fireball,Heard: 1 min Seen: 5 sec,We heard a low intermittent unexplained rumble then a bright fireball took off headed away from us.,9/9/22,
455,9/4/22 22:18,Mastic Beach,NY,USA,Other,About three full seconds,A crescent-shaped light that seemed to be cut off by going behind something.,9/9/22,
456,9/4/22 22:18,Norfolk,VA,USA,Other,2 minutes,"Saw an object in the sky with a white flowing glow around it move through the sky, at a fast, smooth rate and then disappear in the sky",9/9/22,Yes
457,9/4/22 22:18,Norfolk,VA,USA,Unknown,2-4 minutes,"Just got home from seeing our grandchildren. We were sitting out front facing our house, which faces us towards the Chesapeake Bay!",9/9/22,
458,9/4/22 21:15,Cambridge,England,United Kingdom,Circle,2 minutes,Strange Craft,9/9/22,
459,9/4/22 20:51,Creston area,BC,Canada,Disk,3-10 sec,"tried to capture a mountain fire, but it was dark so I put on the flash took 2 more, flash showed the 2 objects",10/8/22,Yes
460,9/4/22 20:02,Gatineau,Quebec,Canada,Disk,one quarter second,A bright disk captured in infrared on camera facing upwards,12/22/22,Yes
461,9/4/22 20:00,San Clemente,CA,USA,Light,About 3-4 minutes.,Unidentified lights in night sky,9/9/22,
462,9/4/22 15:30,Montara,CA,USA,Cylinder,1-2 minutes,Large cylindrical structure was seen at the top of mountain adjacent Montara State Beach area in the vicinity of Montara CA.,10/8/22,
463,9/4/22 13:46,Nampa,ID,USA,Rectangle,2 - 3 seconds at most,"Never saw actual object, heard pops, saw damaged windshield later, reviewed dashcam and discovered sighting of the object and damage.",12/22/22,
464,9/4/22 13:40,Albuquerque,NM,USA,Sphere,Approx. 20 seconds,Sphere and oblong shaped crafts spotted motionless a few hundred feet in the air.,10/8/22,
465,9/4/22 03:30,Assateague Island,VA,USA,Changing,Hour +,Rapidly moving craft changing shapes,9/9/22,
466,9/4/22 02:00,Darrington,WA,USA,Star,1 hour,Light Craft,10/8/22,Yes
467,9/4/22 02:00,nr Matlock,Derbyshire,United Kingdom,Unknown,15 mins,"Behind the house the light was emitting from the clouds like search lights, white and pulsating.",9/9/22,
468,9/4/22 01:00,North Freedom,WI,USA,Light,2 hours,"Orb in high orbit/altitude that moved sporadically in various directions including circles, zig-zags, wave like motions",9/9/22,
469,9/4/22 00:25,Spokane,MO,USA,Light,18-36 seconds,"I saw two lights, one of which looked like it was chasing the other, and they made a sharp turn extremely quickly.",9/9/22,
470,9/4/22 00:17,Sherwood,ND,USA,Light,10 minutes,Found taking pictures of aurora borealis,10/8/22,Yes
471,9/3/22 23:28,dunstable,,United Kingdom,Disk,,look bright like a star but moved across sky,12/22/22,
472,9/3/22 23:22,East Bend,NC,USA,Changing,3:40,Strange flashing lights forming different shapes,9/9/22,
473,9/3/22 22:52,Exeter,PA,USA,Light,Just a few seconds,I was driving home and saw this weird pink oval with two more right behind it.,9/9/22,
474,9/3/22 22:30,Miami,FL,USA,Other,5 seconds,Hexagon shape,9/9/22,
475,9/3/22 22:30,lincoln,VT,USA,Circle,15-20 minutes,a large glowing reddish orange circle/sphere,10/8/22,
476,9/3/22 22:23,Chicago,IL,USA,Light,A few seconds,What happened was I was watching TV then I see this bright light outside my house then I see a bright light just go fast,9/9/22,Yes
477,9/3/22 21:45,Cambridge,VT,USA,Other,45 seconds,Fire red pulsating ball,9/9/22,
478,9/3/22 21:14,LYNBROOK,NY,USA,Circle,2:43,5 Low flying amber orbs,9/9/22,
479,9/3/22 20:36,Manchester,,United Kingdom,Circle,10/15 seconds,UFO no doubt about it,9/9/22,
480,9/3/22 20:31,Austin,TX,USA,Circle,1,I am posting this story on behalf of a friend who actually witnessed this craft and after sending me a picture I am compelled to report,9/9/22,Yes
481,9/3/22 20:24,Greenville,FL,USA,Circle,5 minutes,Saw flying objects about 100 yards above the tree line and looked at it from thermal imaging scope,9/9/22,
482,9/3/22 20:20,Rangeley,ME,USA,Star,20 / 30 minutes,Saw light traveling from south to north than other lights from east to west with one coming to a stop and reverse direction than disapp,9/9/22,
483,9/3/22 19:00,Orlando,FL,USA,Light,Few seconds,4 bright lights moving fast in sync,9/9/22,
484,9/3/22 17:00,Hedgesville,WV,USA,Circle,Every night all night,"Seen at day and night 5 bball sized orange spheres that spyed on us without lights on. Metallic softball sized spheres, large entity",10/8/22,Yes
485,9/3/22 00:50,Framingham,MA,USA,Teardrop,4 seconds,I was driving coming on to rt 30 when I looked up I could see a tear drop shaped orb that had a bluish green light tail.,9/9/22,
486,9/2/22 22:30,Norfolk,CT,USA,Changing,8-10 hours,Constantly changing shape object,9/9/22,Yes
487,9/2/22 22:30,Los Angeles,CA,USA,Light,30 minutes,Point of light exhibiting non-ballistic motion,9/9/22,
488,9/2/22 21:45,Stoneham,MA,USA,Light,One hour,"This is the 2nd time seeing this craft. I saw it a few months back and it was in the sky from about 2am-4am,this time was about 9:45pm",9/9/22,
489,9/2/22 21:45,Cardiff,City and County of Cardiff,United Kingdom,Triangle,5min,"Was low in the sky, but passed me overhead",10/8/22,
490,9/2/22 21:00,Charlette valley,NY,USA,Sphere,bright orb& shooting star,Shooting star followed by a huge bright glowing orb hovering just above a mountain top.,9/9/22,
491,9/2/22 21:00,Hedgesville,WV,USA,Changing,10 minutes approximately,"Driving n see a orange ball flying 5 times fast as plane beside me in a field as if racing or chasing me, I pulled over and stopped.",9/9/22,Yes
492,9/2/22 20:57,Brookings,OR,USA,Light,4m,Not sure if it was one or two,9/9/22,
493,9/2/22 20:40,Fairmont,WV,USA,Sphere,Roughly 3-4 seconds,Orange sphere in the sky,10/8/22,
494,9/2/22 19:30,Saint Petersburg,FL,USA,Oval,One minutes,4 or 5 hazy white lights that made the shape of an oval that moved back and forth from east to west of a distance of about one mile.,10/8/22,
495,9/2/22 19:21,"20 miles west of billings, mt",MT,USA,Sphere,1 min. Approx,Metalic sphere moving at approximately 3000ft elevation,9/9/22,
496,9/2/22 18:20,CLIFTON PARK,NY,USA,Changing,3 weeks comes and goes,2 illuminated craft that changes shape(video),10/8/22,Yes
497,9/2/22 18:00,Stony Brook,NY,USA,Oval,5 minutes,Bean shaped object,10/8/22,Yes
498,9/2/22 07:45,Lago Vista,TX,USA,Circle,About 15-20 minutes,Bright like it was a planet but too light out to be a planet,9/9/22,Yes
499,9/2/22 03:00,Fairmount,IL,USA,Triangle,Hours,V or triangle shoes craft 3 lights one in front larger/brighter,9/9/22,Yes
500,9/1/22 23:45,Hartly,DE,USA,Other,About 3 seconds,A faded contrail type of craft moving quickly over a friend's house,10/8/22,
501,9/1/22 22:00,Bridgman,MI,USA,Light,1hr,"2-7 lights that hovered, changed directions many times, multiplied, unfathomably fast",12/22/22,
502,9/1/22 21:59,hingham,MA,USA,Cylinder,2 mins,I was outiide with andrew gardside and we say all 69 of the ship show we we very scared and thoguh we were going to die.,10/8/22,Yes
503,9/1/22 21:09,Wheelersburg,OH,USA,Disk,1 minute,So we were walking to our house and we saw a UFO and it was VERY big!,9/9/22,
504,9/1/22 20:55,Evansville,IN,USA,Light,5 minutes,I look out north and see a strange light formation,9/9/22,
505,9/1/22 20:37,Sierra Vista,AZ,USA,Cylinder,approxamently 3 minutes,"2 craft super bright lights overcast night, turned into one craft",9/9/22,Yes
506,9/1/22 19:56,Scranton,,USA,Light,A few seconds.,"Big light in sky. Was low, unmoving. Then disappeared.",9/9/22,Yes
507,9/1/22 19:51,Dudley,England,United Kingdom,Sphere,2 mins approx,"Saw it just stationary absolutely piecing white light, my son ran to get my phone",9/9/22,
508,9/1/22 19:31,Baltimore,MD,USA,Changing,2 minutes,Extremely low flying dark flat object followed by white ball sighting,9/9/22,
509,9/1/22 18:22,Bluffton,IN,USA,Sphere,About 5 minutes,Ball of light inside of a box,9/9/22,Yes
510,9/1/22 18:12,Tiverton,RI,USA,Triangle,5 minutes,Ufo interacting with plane,12/22/22,
511,9/1/22 09:14,,MT,USA,Disk,Duration of a minute or t,We were driving thru Montana on the way to Washington. My dad pointed out that a hot air balloon was in the sky so I took pics,10/8/22,Yes
512,9/1/22 08:00,Nazareth,PA,USA,Triangle,,Black Triangle,9/9/22,
513,9/1/22 02:43,Hilton,NY,USA,Unknown,"Over 1,5 hours so far","This craft was hovering, weaving and spinning.",9/9/22,
514,9/1/22 01:30,Fayetteville,NC,USA,Light,10-20 seconds,"I witnessed a point of light (assuming a star) at the moment turn into a ball of different colors, then descend.",9/9/22,
515,9/1/22 01:23,Chesapeake,,USA,Delta,,I was in my room and I seen three entities with a light. Now I suffer with headaches things talking to me all the time,10/8/22,
